review_body,is_positive_sentiment
"It's okay.  Interesting as a classic - and there's also something to be said for comparing this to other versions of the story.  Not terrible...and watchable, too.  A favorite of mine, though?  No.  Not really.",0
Watch a show every night love it,1
K,1
My kids really loved this at. First but tired of it more quickly than other shows we've purchased,0
"&#34;Hand of God&#34; - blaspheme to the highest degree, plus profanity and sex. There is &#34;NO GOOD END TO A BAD MEANS.&#34;",0
It is just ok.,0
I would really like to buy the whole season rather than pay $2 a week!,1
"It would have been interesting to see how a civilized society can collapse due to a disease epidemic in spite of efforts of goverment, police, doctors and media to avert a disaster.  Goverment appears nonexistent, police are either stormtroopers or looking out for themselves, and the media are limited to the few seconds of screen time and only in passing. There are no interviews with police, firemen, paramedics or witnesses, a riot occurs and only one camera is out to record it. Hundreds of other cell phones stay in pockets, no one tweets or post to social media. The characters must be on a plan with no data, no text and very limited minutes because they only call on occasion and don't bother to convey any useful information. When bit the victims seem content to sit and die if there is no answer on 911. To summarize the social and civil milieu is not remotely believable. I won't comment on the characters as they are already taking a beating. I can suspend disbelief for zombies but the rest is asking too much.",0
"It was a total waste of time, mostly due to amateur editing. Seems like they ran out of film and just decided to call it the end.",0
"As powerful as ever. Great performances, great film. Story line still holds up even 46 years later.  I know I'll watch it again",1
Gran-children enjoyed watching this movie.,1
"I've been in a love / hate relationship with this set of movies since the very beginning. I remember seeing the original Mad Max when I was a teen, and at the time I liked the movie a lot. When Road Warrior came out, I absolutely loved what a bigger budget, and better filming could do. And then ThunderDome happened ... not a horrible movie, but not what I was hoping for.  Going into this movie I had fairly low expectations, and I walked away liking it more than I thought I would, but wishing for a whole lot more. When reviewers say it's one long chase scene, they weren't lying. And while action packed, with amazing stunts and film work, I was left wanting to know more about the characters:  how did the cult of the war boys form;  who built this oasis in the desert;  how did the characters we are introduced to, get to where they are.",0
Love this show. Never been disappointed with any episode or season.,1
Funny and Wonderful!! Anyone- from any kind of family- will love this movie!!,1
"The way this beautiful story is woven together is just genius.  The director could have made it sound so sad and depressing, but the ending brought tears to my eyes -- God is so good and this wonderful Pastor is such a gorgeous example of Christianity!",1
awesome,1
Such an adorable movie!,1
Kind of a disappointment,0
"Amusing story with a certain appeal. The actors are a very capable bunch. The story has an appeal to gay and non gay viewing audience members. The late Mr. Reborn was a very good, believable character actor.",0
"In a time of turmoil, it is so refreshing to watch a sweet movie with a happy ending. I recommend this for all ages.",1
Should have stopped after 8 seasons.  Lost the humor and became repetitive.,0
Boring,0
Excellent,1
"It was worth watching. Beautiful scenery, soundtrack was nice in that it was there and beautiful music, but only accompanied the story. She found her natural talent despite the boys club. I liked it. I would watch it again sometime.",1
"Rusty (Ed Helms) is grown and an airline pilot for a small airway. When the neighbors are over for dinner, he sees an enormous amount of father-son bonding, that he become envious and realizes his family is in a rut. He decides a vacation to Wally World (and not Paris) is what the family needs and announces to the audience &#34;The new vacation will stand on its own.&#34;<br /><br />His family is a bit dysfunctional.  We discover his wife Debbie (Christina Applegate) was known as &#34;Debbie do anything&#34; in college. As a side note, I don't believe there is a Memphis State University, but the University of Memphis is a dry campus. Kevin (Steele Stebbins) the younger son swears excessively, wrestles, and likes to bully his older brother James. James (Skyler Gisondo) who &#34;doesn't have a vag.., but it would be okay if he did&#34;, keeps a wish diary.<br /><br />The film was funny. The humor was cruder, more sexual, and there was a lot of F-bombs, 58 to be exact. The film also allowed itself to draw some similarities to the original vacation, such as the girl in the car, but didn't over do it. Chevy Chase and Beverly D'Angelo appeared near the end which was a bit anti-climatic. The best humor came when they did a misdirection from the formula. Perhaps the biggest laugh was provided by the family car.<br /><br />Guide:  Plenty of swearing, sex talk, brief nudity.",1
"a good movie.  not great, not truly exceptional, but well worth watching.",1
"First let me say that my review does not reflect on the people involved here as...well...people. I hope you all live happy lives. BUT! This was the most forced, corny, laugh less movie I have ever seen. Relying on BAD slap stick and painfully obvious jokes, this movie is LAME. I was so embarrassed for Jenna, Harley, and Grace. You could tell they were just doing these two guys some friendly favor by being in this. Anyone who gave this movie a 5 is a mindless fan boy/girl, yeah you, you tasteless pandering puppets. Watch the movie Idiocracy and see what our future will be like if we keep patting idiotic efforts like this on the back. So sad how everyone these days so badly wants to be in on what's hip that they'll say anything is awesome just to fit in...even if they know it's terrible. Sheep.",0
THE END WAS SORT OF INCOMPLETE.,0
"You have to get past the over-acted dubbed American English voices and it may be a cute movie for some kids, but even our 8 yr old grandson found it unbelievable and silly.",0
not as good as the book,0
"The lead character, Sydney, is an alcoholic, chain smoking, carousing priest who partners with a an alcoholic, chain smoking detective to solve crimes. Social themes are presented anachronistically in the 1950's setting, with the tolerance that is expected in 2015. The two voices of propriety are an overly stern house keeper and a mousy curate with no confidence.<br />It's unfortunate that a potentially good show is ruined by depressing themes. If Sydney's character does not turn sharply for the better and stay there, we won't be watching season 2.",0
"HORRIBLY made!  Even children cannot understand this mumbling, fast talking little girl; it is not a way to TEACH French.  And the main actor is so unenthusiastic & almost visibly uncomfortable; who hired him?  PLEASE save your money & skip this low-budget anomaly.",0
Couldn't get through this.,0
"What does it say about a movie that has made me cry at the end since I saw it for the first time as a kid. It's funny, emotional, and action packed and I will never forget the impact this movie has had on me. 6/5 stars",1
Bad movie!!,0
Predictable preteen movie other obvious object lesson,0
"Too much unnecessary, terrible language and the slang talk is over the top. Half the time, it was hard to understand what they were talking about and the relationship between the 4 guys was forced and uncomfortable.",0
Didn't like.,0
Awesome movie,1
"Loved the show, but I feel dogged that the last episode didn't have closed captions.",1
Very well done,1
Classic 80's hit,1
This was such a sweet movie.,1
This wonderful series compassionately opens family closets that have remained in the dark far too long.  This amazing cast is headed by the transcendent Jeffrey Tambor.,1
I guess it was a good movie,1
"While  in agreement  this is not one of Cameron Crowe's strongest efforts, it is far from being a bad film.  I personally believe sometimes when an A-list talent like Mr. Crowe  comes out with a highly anticipated movie, that the bar  for the critics and the audience is already somewhat higher from the outset.  So, I believe the playing field is not quite level from the outset when reviewing the film compared with other films of the same ilk.<br /> So, what I believe is a film that is worthwhile and enjoyable has been simply knit picked to death, from what was considered questionable casting of the Emma stone character to the pace of the movie etc.  The bottom line is, this film was enjoyable, well acted and worthy of an audience.<br /> It is simply a fun, lighthearted  well directed romance film that will likely not disappoint 80% of the people that give it a shot. Aloha!",0
"Became infatuated with Mads Mikkelsen in Hannibal. He did such a brilliant acting job in that show I decided I could survive a subtitled movie if he was the star. It was a very powerful performance of a very difficult subject. Would recommend this brilliant drama to anyone, English speaking or otherwise.",1
What a great perk on Amazon Prime. My 4-year-old loves this series. We are all learning some French! Little Pim is a cute panda and the video includes both animated skits with Pim and friends and pictures/videos of real people and things. There is enough repetition to aid in learning and the narrative is clear and easy to follow. The entire video is in French for a good immersive experience for ages toddler to adult.,1
Very strange.,0
Fun to watch.  I added movies to my TIVO.,1
My 11 year old can't get enough of this show.,1
"If you are over 18 this film will not work for you. I turned from Stephen Greenblatt's book, &#34;Swerve&#34; for a break but this film lacks swerve, lacks a solid script and experienced enough actors to bring it off.  The parents are nicely played, always loving, always fun but the script isn't heavy enough for novice actors to &#34;create&#34; weight enough and lift their burden as creators to the level of art. The &#34;swervy&#34; conclusion, unfortunately, does not justify the hour or so investment getting there. It's an old gimmick captured years ago in a better way by Ambrose Bierce's &#34;An Occurrence at Owl Creek Bridge.&#34;",0
Kinda slow to start and have yet to feel attached to any of the spoiled characters. But it has zombies...,1
I just love how the show always shows almost every step of the process very informative and entertaining.,1
Amazing entertainment,1
"I've seen this movie probably 100 times, Denzel is one of my favorite actors of all time, and this movie is by far my favorite movie ever. Every time I watch it, I find one bit of foreshadowing or some other detail that I have never caught before. Each time watching it is as good as the first time if not better. Highly recommended.",1
"This movie crushed me.  I was so bummed after words.  All I kept thinking was, we as a society created her.  Having worked with people who worked with prostitutes, I'm very surprised there are not more like Aileen out there.  This is a great social commentary movie.  All that aside, Charlie Theron was incredible in this movie.  Absolutely riveting.  This movie is sad and frightening as it is based on true events.  I imagine I will be hard pressed watching this again as it is burned into my head.  Once maybe enough.  BUT!  Once should be mandatory.",1
This movie was a let down and I sure wouldn't rent it again. Didn't even finish watching it.,0
It was ok. I like the actors but the show kind of lags.,0
Great movie.,1
Good movie with a surprise ending,1
"Nice idea, poor execution.",0
Never heard of this movie before seeing it. What a great surprise! Bring your tissues.,1
Really really good,1
Must watch!,1
"This is a classic ...the ill-fated attempt to drive into germany through holland, which was Montgomery's plan.  Eisenhower did not want to do it, but Monty whined to Churchill, who pressured Eisenhower, who finally agreed.",1
"My 6 y/o daughter loves this show.  I would have to believe that it is the product of market research on a target audience of girls my daughter's age as it has fairlys, unicorns, mermaids, majic etc... Everything she loves.  It also appears that amazon has listened to earlier reviews and addressed the wishing aspect by having Bianca go beyond just waving her wond to solve problems to verbally working them out w/o the use of majic.  Well done Amazon; my daughter eagerly looks forward to more episodes.",1
Could't handle more than 5 minutes of story.,0
Too slow. Not much hapening,0
Gripping story about good guy holding fast.,1
Excellent movie.  I am surprised that Alexander Putin found the movie unfair.,1
A romantic concoction set in a different time having only the vaguest connection with the actual events that inspired it. Entertaining enough for what it is - a gruesome depiction of Stalin's Russis - but CitizenX which sticks closer to real history turns out to be a better and more chilling narrative even without the extravagant production values or big-name stars.,0
"This could have been a great movie. It has a top notch A list cast, good director, but the way it was written was very poor.  I am not sure what was worse, the way it was written, or how it was put together post production.  Most good stories have 3 acts, beginning, middle, and end. This had one long beginning that crashed into and ending in the last 15 min.  Character setup dragged for the entire movie. You could not tell if it was a homicide at time, a drama, or romantic flick. Any conflict in the movie was muted, and it just dragged on.  If it would have been better written and directed it could have been a great movie.",0
My 10 yo son gives this 4 stars,1
"In my opinion, the smartest thing the producers could do is bring it back.",1
Funny! Kept me intrigued. Great entertainment for all ages.,1
I love these Cuban people. Talk about a resourceful and helpful community! I love to see the culture and their resourcefulness. I mean... one guy has a diesel BOAT MOTOR in his car... whaaaaat??? No bumper? No problem! I'll just MAKE MY OWN. These guys are great.,1
Even better than the first one.,1
My toddler loves this cartoon series. I don't think she has learned anything undesirable from Strawberry and her friends. Only cuteness!,1
Excellent acting by Kristen Stewart and Juliette Binoche.  A complex drama which never completely reveals what happens but still leaves you glad you shared the drama of the two leading women characters.,1
meh,0
Amazing and a great insight into what happen in an atelier,1
"Meh.  It's ok.  It didn't scare me at all.  There was one creepy scene when she first encounters the entity in her house upstairs.  Other than that I thought it was kind of transparent.  Also I did have a hard time deciphering the end game plan, almost like a scene was missing.  When the posse has the entity in the pool, I thought they were going to run their game plan which is all around the pool.  (Being vague here to avoid spoilers) which they didn't.  Mostly the movie was panic, running and making one bad decision after another scenes.  I'm not sure what I would have done different, but side note: This really reminded me of the Extremely long death with a highly inefficient weapon video on YouTube only with way more boobs.  It's an ok watch, but it's not The Ring in the scare the crap out of you class.",0
We had trouble following the story and it didn't keep our interest.  We watched it because what seemed to be a great cast which usually means a great movie but this one wasn't.,0
"didn't watch complete documentary - if you can call it a documentary. Not an objective piece, but rather one more &#34;open border&#34; propaganda film  from your friends on the left.",0
I did not connect with any of the characters and the story line dragged. Boring.,0
"Very interesting WWII piece, longer than I thought, and complex.",1
Low on acting and dialogue.,0
I was immediately hooked!,1
it was good,1
Pretty well done given the magnitude of the event. British and Poles had the worst of the campaign and they get most of the time in the film.<br /><br />I wonder if they did not show actual footage of the drop? Impressive nonetheless.<br /><br />The campaign was a fiasco and a tragedy. Story tells that pretty well.,1
My wife and I truly enjoyed this movie.  It's a great reminder of the huge price already paid by our Lord Jesus Christ for whosoever believes in him.,1
We love this quirky Nick show. It's funny with a bit of action and usually a small moral lesson if you look for it!,1
"Quick Review: This is a top notch production. The apocalyptic story, script and acting is superb. The pretty Haley Lu Richardson is outstanding as the main character. So much is learned on survival through this movie.",1
"One of the strangest documentaries I've ever watched.  I thoroughly enjoyed it, though.  It is too bad that it's still an unsolved case.",1
Amazing family!,1
"Boring, repetitive and monotonous.  While strongly feminist in its message, it is still only of interest to an Orthodox Israeli audience.  For the director to ask viewers to watch the entire movie, regardless of well it may mirror actual life; regardless of it's conclusion, is ask far too much.",0
grimm!,0
Horrible. It is not a story. Is it a reinactment of facts told in a dramtized way imitating a bad Dicovery Channel series. The story is short and they stretch it to its limit with drama. It should be more well discriminated in the summary of the product. Lost my money.,0
Victor Hugo really captures the idea of redemption in his novel les miserable. The music adds another dimension and the 2012 cast members really bring the essence of Hugo's classic to life. Could've done without the violence heaped on Fantinebut overall I really Love this movie.,1
HA HA. I remember seeing this in the movie theater.  It is good old fun.,1
Good,1
"Great movie, great story.  Apparently Sy is now dancing in the Carolinas.  I really enjoyed it, worth your time to watch.",1
"Not a bad way to kill some time when there is nothing better to watch, but this series certainly does not break any new ground. A somewhat intriguing concept, of animals turning against us, but the series is inconsistent in it approach and logic. The actors do an acceptable job, working with what they are given, but I would have liked a bit more realism and suspense.",0
Extremely fun!,1
"&#34;Tijijiapan, I've been there&#34;.",1
Did not hold my interest. Slow moving,0
"Worth watching. However, doesn't really deliver on most of the plot points. It's like...you haven't eaten pizza in like 3 months....then you finally get to eat pizza....and it's average and you are alright with it...but you kind of wish you had eat pizza somewhere else.",0
"Too much Psuedo-science, weak plot.",0
"Great actors and theme potentials, but the series turned out disappointingly mediocre when it should have been brilliant.",0
"Now, I am not a member of any Special Operations, but I have read my share of biographies and watched enough documentaries to know that this show is full of bs. The writing is bad and not well researched. The bad information is way too distracting and unbelievable to warrant sitting through an entire episode. I don't think I even finished the first one.",0
"In 1993 in Beatrice, Nebraska the high school put on a play called the gallows. An accident occurred on stage were Charlie was hung. Twenty years later that same high school is putting on that same play because it can. Football player Reese (Reese Mishler)  joins the drama club and plays a speaking role next to drama queen Pfeifer (Pfeifer Brown) on whom he is crushing. Ryan (Ryan Shoos) films the whole thing and Cassidy (Cassidy Gifford) provides some addition cleavage.<br /><br />The problem is Reese can't act so they decide to sabotage the stage so the play will be cancelled and Reese won't embarrass himself. A stage that is supposedly haunted.<br /><br />This film suffers from the same thing as all hand held camera films.  We have dark cam, the hall whispering cam, the what is that cam, the foot cam, the green cam, and the green foot cam. All this makes for a bad film. The twist at the end, I admit I didn't see coming. I liked it. The problem I had with the twist is that there is a &#34;discovery&#34; of things that happened 20 years ago, secrets I didn't think would exist in a small town where everybody knows everyone's business.<br /><br />Guide: 1 whispered F-bomb. No sex or nudity.",0
"In 1993 in Beatrice, Nebraska the high school put on a play called the gallows. An accident occurred on stage were Charlie was hung. Twenty years later that same high school is putting on that same play because it can. Football player Reese (Reese Mishler)  joins the drama club and plays a speaking role next to drama queen Pfeifer (Pfeifer Brown) on whom he is crushing. Ryan (Ryan Shoos) films the whole thing and Cassidy (Cassidy Gifford) provides some addition cleavage.<br /><br />The problem is Reese can't act so they decide to sabotage the stage so the play will be cancelled and Reese won't embarrass himself. A stage that is supposedly haunted.<br /><br />This film suffers from the same thing as all hand held camera films.  We have dark cam, the hall whispering cam, the what is that cam, the foot cam, the green cam, and the green foot cam. All this makes for a bad film. The twist at the end, I admit I didn't see coming. I liked it. The problem I had with the twist is that there is a &#34;discovery&#34; of things that happened 20 years ago, secrets I didn't think would exist in a small town where everybody knows everyone's business.<br /><br />Guide: 1 whispered F-bomb. No sex or nudity.",0
I am a huge horror movie buff and I wasn't really that impressed with this one. The background soundtrack seemed cheap. The suspense was not really there. It had its moments but I expected more. I'm still confused by the way it began and how it ended.,0
"Rhymes with &#34;horse manure.&#34; Incredibly dull, way too long, pointless. Even the avalanche scene is a yawner.<br /><br />OK, people brush their teeth and urinate. I got that the first time. I didn't need to see these actions repeated over and over, especially Mom squatting in the woods.<br /><br />Why the photography cutting off people's heads while they are talking? Maybe this is supposed to be &#34;art,&#34; but it looks like lousy cinematography.<br /><br />The DVD jacket quotes a review as &#34;Hilarious.&#34; Huh? &#34;Depressing&#34; would be more like it.<br /><br />The kids aren't even cute.",0
"A great  romantic period piece... probably the best one I've seen in a long time... I was pleasantly surprised at how much I liked this movie.  The main characters of the movie end up together because despite their misfortunes & shortcomings they are alike in their character... their work ethic , passion and love and caring for other people eventually put them on the same path... the stronger of the two patiently endures but retains dignity and  makes it clear that a decision must be made or the two of them must take different paths.",1
It..... Sucks.,0
Had you thinking after the movie.  It was deep.  Loved it,1
"The basic message of this movie is focusing on satisfying your spiritual needs will make you happier than focusing on satisfying your material needs. This not really a groundbreaking idea, but the movie did make me stop and think about my priorities. Ultimately though the movie offered little beyond that, as their examples of happy people were a woman in Denmark who moved into a commune, a man who gave up his life to take care of the terminally ill in Kolkata, India, and an excruciatingly long sequence of elderly women in Okinawa, Japan who were happy because they met each other regularly, lived off the land, and took care of each other's grandchildren. Obviously nobody is going to be in these extreme situations, I wish the movie had focused more on how average people had improved their happiness. The other message was that surrounding yourself with family constantly would improve your happiness, but I can't stand most of my family members, so what do you do then? Movie had a lot promise, but ultimately delivered an overly simplistic message. Needed more depth, and more realistic examples of how people could improve.",0
Just loved this film!  They make far too few realistic movies these days but this one is in my crown jewels!,1
"Amazon's current description of this movie doesn't have anything at all to do with the actual movie.  Amazon's description refers to the transgender performer, Barbara Herr, and not to the classic tale from the Henry James novel.  :D :D :D<br /><br />Nicole Kidman with her young fresh face completely devoid of makeup.  The divine costumes of rich fabrics. The beautiful gardens and scenery.  Great story.  Great acting.  Great escape from daily reality.  Great rainy day home alone kind of movie to watch so you can immerse yourself in the story.<br /><br />John Malkovich is the perfect insidious bad guy - soft spoken, manipulative, & completely evil. So good at being evil you'll still hate him when the movie ends. :D",1
We love Ben Mendelsohn so rented this Australian film. It was OK...a fun depiction of a psychotic family but not a masterpiece.,0
"Terrible Movie... first 2 movies were great, this should have never been made!",0
its very good,1
Excellent film; we really enjoyed it.  I'm surprised we hadn't watched it earlier.,1
Excellent streaming quality,1
