review_body,is_positive_sentiment
"These guys make really beautiful cars and really terrible business decisions. You get the entertainment of seeing into the minds of hoarders, without the stuff that makes you gag (eg. dead cats, roaches, all of the nasty stuff that you see on other hoarding shows). There are some really stunning cars on here. Another nice thing is that you really feel like they are doing good things for these hoarders. It's an uplifting show. I just wish that they could actually make some money. Great show. I can't wait for the next season.",1
Not a lot of dialogue or plot development but action from minute 1 until the closing scene.,1
Great show is there another season? 😋,1
Kind of slow moving but story line is good!,1
"I saw Dead Weight in 2012 and have been telling people about it ever since. Do I like it? I bought it twice, so yeah. After I walked by a table with a couple of guys selling their film, I was immediately captivated by the cinematography that was being shown on the 10 inch screen. This looked too well done for a project that didn't have a big studio behind it. Needless to say,  it was better than I thought.<br /><br />Dead Weight is a survivor movie more than a zombie film. With dark humor and a little romance, it surprised me with the connection I made with the characters which is in large part due to the writing and editing of the film. Unlike most post apocalyptic films, it is the journey of a group not only trying to survive starvation, the elements and other survivors but with a specific destination that keeps them going.  Specifically, Charlie who is going to make this destination no matter what in hopes of reuniting with his girlfriend Samantha.  With no confirmation that his girlfriend Samantha is even there, Charlie becomes obsessed and nothing will stop him. If you are an obstacle or defy the path, you're dead weight.<br /><br />Most horror stories focus on the monsters that are made by bug, bird or whatever outbreak the writers decide to develop. This film DOES have monsters and they are man made. The only difference is these monsters know how not to be monsters and still act less human than the things in the dark.<br /><br />John Pata and Adam Bartlett do a superb job of directing and writing with editing that is award worthy. I truly look forward to what these gentlemen will show us next. Joe Belknap does a fantastic job for a first time acting role.  Aaron Christensen, Michelle Courvais and Mary Lindberg give spectacular supporting performances as does the entire cast.<br /><br />As I said in the beginning,  this is a survivor movie.  Surviving the elements, surviving your fellow survivors, surviving exhaustion and ultimately yourself. I recommend DeadWeight as a superb horror drama.",1
"This is a well researched and informative documentary, and worth watching just for the interviews with Georgia O'Keefe. How they got her to agree to be interviewed, I don't know, but it says something about the producers that they were able to accomplish this.<br /><br />We've all seen Mr. Strand's photos, so I think the whole point in watching a movie about him is to learn more about him and his life.<br />I have to disagree with the reviewer who thought the (quite brief, actually) segment about his career in film making was slow, as my impression was quite the opposite, and since this is a documentary film and Mr. Strand spent many years as a movie cameraman it's completely logical that this would also be a part of the film, not just his still photography. I thought this segment was very interesting, especially to see his film making style, which reminded me of Sergei Eisenstein's, and which we probably won't see anywhere else, and to learn that he was taking on very serious subjects such as racial intolerance, the KKK, and McCarthyism. Also that his decision to move to Europe was largely because of these issues.<br /><br />Seeing Mr. Strand wielding his monstrously huge Graflex SLR (5x7?) was also a highlight.<br /><br />The musical soundtrack was nothing special, kind of typical of a low budget documentary, but I wasn't watching the movie to listen to the music. The &#34;Ken Burns&#34; style of showing the photos was the weakest and most distracting part of the film for me. I felt that the film makers should have displayed the photos in full view first, and then panned around if they felt the need to push that button on iMovie. If the rest of the film had not been so informative I would have knocked a star off for this, but there was so much else about it that was really good that I kept it at five.<br /><br />I was not surprised at the end to learn from the credits that this film was funded by the Canadian National Film Board. I have watched numerous documentaries funded by this agency, and they have all been of high quality. One can also go to their website and watch a lot of movies for free. Most of them were made by the CBC.",1
Do not recommend.  Violent and twisted.,0
"I gave 5 stars for this silly, funny man!  Of course, this was prompted by &#34;memories&#34;.  Soupy Sales was a hit back in the early 50s - remember this is still the era of wonderful corny humor.  To, not only hear, but also see humor was just becoming available.  Television sets, as they were called, were not in every home - neighbors invited neighbors - to see this visual treat.<br />My friends and I decided we would visit the show one evening - live TV.  He broadcast from Detroit - still a vibrant,stable city then.The show did not make accommodations for an audience.  Soupy, his crew of cameramen, prop people and these fans were the only ones there.  We were directed to stand any place except on the set.  Soupy was funny every minute we were there - the lines was spontaneous - I doubt rehearsals were a part of readying for his show.<br />I highly recommend Soupy Sales Shows for almost all ages - but you must have an accepting, quirky sense of sight humor..  Also, be sure to get up, walk around and breathe deeply between shows...",1
Someone paid to see this garbage?,0
Discovered this great program several years after it started. First season is the basis for all the individual family stories. Although each and every episode is well written and able to stand on its own it helps to know what happened in the past. I love the show and am enjoying going back to the beginning.,1
Waste of talent for Streep and Cage.,0
"I did love this movie.  There are so many movies anymore that are not fit to watch. This was a nice love story but guys will like the bull riding<br />that's performed.  One of the things I like about Amazon movies, at least the prime movies, is you can stop watching any time.",1
Waiting to see where the season goes.,1
I was terribly disappointed. This was not an upbeat movie.,0
Awful.  Save your time and money.,0
This was an interesting story but not an exciting story. I felt sorry for Chris and his siblings but it can be depressing to see so much dissension between parents and their children as well as parents who evidently do not want to admit to any of their own apparent shortcomings.,0
Ridiculously inept show,0
Waste of time!!!  Has been taken of the Watch List and will never return.,0
"The cast seemed way too old to me. Why are all of these 30-year-olds still in high school? Aside from that, it was a touchy-feely film that tried way too hard to relate to today's high school students. The moral of the story is that you'll always be better off just being a nice person. The message was too simple to justify a 45 minute story. A younger audience might not see the flaws and be entertained by the premise.",0
"I had read reviews about this movie, but I saw it anyway. Being in art school myself, I looked at Turner the person. It was a different time and views of work were way different. He was a sloppy man, disheveled creature. But that is a good enough definition of most artists of that time. Poor, old clothes,",1
"I wish I had read reviews before I started this movie!!! I watched for less than 3 min. but I was disgusted at how it began, I wouldn't watch any more. Then, I read reviews and it sound like I missed nothing.",0
Great Kids Movie with energy!,0
Very boring. Nothing like The Walking Dead. Waste of money.,0
My third favorite werewolf movie after American Werewolf in London and the Howling.,1
Best since NYPD Blue,1
Can't follow the Brit dialogue,0
"This movie was horrible!! May I have my money back?<br />If I could give 1/4 star, I would.",0
"True to the character from the novels, as nothing comes easy to Bosch.  Excellent acting all around:  Mr. Welliver has one of &#34;those&#34; faces that seems to become transparent, allowing you to read the thoughts beneath.  I plan multiple viewings.",1
"its definitely not oscar material, but it was not intended for awards, so for entertainment, it's perfect, and MJ is actually good at cartoon movies ...",0
Enjoyed this film very much....although I think its definitely more of a girls film!,1
Don't need to see the love seens so explicit...men and men and all...........rather let my brain figure it out,0
Quirky fun cartoon - feels like something from Cartoon Network.  My family would love to see this as a series!,1
allright.,0
It was a really fun movie,1
"I avoided watching this movie for countless years even though it was thrown in my face by every online movie rental organization. Left with nothing really to watch one weekday spent in a hotel room, with hesitation and reluctance, I began watching this movie. There are many quality actors in it and I have to say that unfortunately, Ms. Paltrow is not one of them. (And I do appreciate her talents immensely.) If you're looking for a somewhat, not too girly, romantic movie with plenty of opportunities to laugh, this is it. Bottom line is that I am pleased with my time spent watching this movie.",1
"A good not great take on Brian Wilson and the Beach Boys.  Slightly better than the previous two made for TV movies about the band. What makes this one worth watching is its focus on Brian Wilson and his struggles with mental illness, and the performances by John Cusack, Paul Dano, Elizabeth Banks and crazy therapist Paul Giamatti. They elevated the movie.",0
Good stuff!,1
Don't waste your time. This is cliche and dumb. But your 5 year old will probably like it.,0
It wasn't as bad as people made it out to be so I was pleasantly surprised. It just wasn't very good.  Some parts were so corny or stupid I was rolling my eyes constantly but the plot and action weren't that bad.,0
Great job on the show! Looking forward to seeing what is to follow :),1
"excellent show, great characters. sorry to see it end.",1
"Boring--we watched one and a half hours of the first episode, and it was slow as molasses. They had to spice it up with a totally unnecessary sex scene, at which time we quit watching.  A waste of time and money.  .",0
I don't like sub titiles,0
"Excellent programs.  Fascinating historically, good drama, superb acting.  The entire series was extremely moving and powerful.  The depiction of life for average people in London during that period, the unbelievable pain and suffering caused by infectious illnesses and trauma, and the level of compassion (and angst) portrayed by the nurses and doctors left an indelible impression.  Several scenes of surgery were quite graphic, which could make some people very squeamish, but they added to the power of the program.",1
"Absolutely terrible. Terrible acting, terrible plot, boring and just...terrible",0
"Wallace and From it's Cracked Contraptions is a fun filled ride and well worth renting right now. The time is ripe for renting w and g cracking inventions and sitting back and having some microwave popcorn and side. The all star duo fill up some tense moments that will make all your current problems seem trivial by comparison. You be in a hurry to adopt your own crackers setting,rabbit batting company from the pound. Rent it now, right now.",1
Robin Williams in a creepy stalkery role! This is a great movie we all enjoyed watching.,1
Best action movie I've seen in a long time. Love the creativity as well; I think that's what really separates it from other action flicks.,1
Boring. A completely crazy woman.,0
"This is by far the dumbest movie ever made. Not even one bit accurate. Atheists are not bad people, stop making them look like the bad guy.",0
A very sad and heart breaking movie. Deals with a side of zombie lore not often seen. Toll on both infected and loved ones was strongly felt. It shows the helplessness of the situation while at the same time show the unwavering love of a father in the middle of such impossible pain and suffering. It was a good melancholy themed movie.,0
So boring. My six year old was not amused. Nor was I.,0
Waist of time.,0
Very informative.,1
worst ending ever==transgender????,0
I watched this show while I was growing up.  I loved it then and I still do. Gilligan still makes me laugh. Why can't they make shows like this today?,1
"Good explanation of the basics. Worked for me, a novice.",1
All the other shorts in the film are worth the money.  If you can just purchase the frozen short by itself I would do that instead.,0
Better if you know the source material but I thought the humor fell flat... and i love these actors,0
"This movie caught me off gaurd. It was funny, but kind of sad to. There are so many people like this guy out there.",1
I loved it.  The two main characters are wonderful. His parents are great also.,1
"Joe Swanberg is changing the face of American independent cinema. In a matter of ten years, he’s managed to direct eighteen feature films (including his latest “Digging For Fire”). Most of these have been made completely outside of the studio-system, being financed through credit cards and actors donating their time. They’re purely improvisational, with Swanberg’s only tool being an outline that he’s authored. The actors, in turn, must completely inhabit their characters to the point of knowing what they might say or even do. “Digging For Fire”, which is undoubtedly his most star-studded film to date, takes this to a whole new level. Veterans such as Sam Elliott and Judith Light are sharing the screen with younger actors like Jake Johnson and Rosemarie DeWitt.<br /><br />The latter couple playing a husband and wife who, after finding a rusted gun and apparent human bone in the backyard of a house they’re staying in, are lead on separate adventures over the course of one weekend. The husband - obviously more curious about what else he might find - invites a group of his long-time friends to drink a few beers and dig up the truth. Meanwhile, his wife takes their son to visit her parents and get away from some of the marital stresses she’s facing.<br /><br />It’s this wonderfully odd comedy/mystery that’s entirely propelled by the connection between the actors and the director. There’s an evident trust between the two, and the movie is infinitely better for that. Not to mention the fact that it’s just a lot of fun to watch. The varied cast works together beautifully (some of the others include Orlando Bloom, Anna Kendrick, and Sam Rockwell) and the story unfolds in a charming and clever fashion. Definitely give Swanberg’s latest film a look. He has a long and storied career ahead of him.",1
"Halle Berry has two emotions, concern and anger. Really poor acting. Story has become so predictable.",0
It was entertaining even if it was predictable and offers a fictional view of the afterlife that is not sugary.,0
Very engaging.,1
A pretty thorough look at the life and how he got there of one of America's most beloved comedians.In the time allowed they cover his start and the many accomplishments he made up to the day he died. A good watch for those who want to remember Robin Williams and see how he became a treasured comedian and civic minded human being. Well worth the time to view.,0
"My 8 year old LOVES this show. I also enjoy it, which is nice because we can watch together and I can be a part of the discussion around science, the value of having a good attitude, self confidence, learning to be ok with mistakes because they are part of discovery...and so much more. This show is entertaining while it shows values of friendship, perseverance and creativity.",1
Good film... Great twist!,1
I liked this movie.  It is based on a true story from the mid 1750's in Pennsylvania.  The movie did not have a wide theatrical release so I did not expect a lot from the production.  The acting and production quality was much better than I expected for an independent release without a sizeable budget.  I am not getting into the &#34;politics&#34; of the historical events but appreciated the faith based portrayal of the immigrant family who left their home in Europe to practice their faith in a new land free from religious persecution.,1
True to Mad Max. Crazy and weird.,1
"HORRID!<br /><br />I wish I could give this zero stars.  This one of the worst movies I have ever seen.  Poor story, poor dialog,poor editing, poor casting, and poor acting..  I can not believe the experienced and well known actors in this movie took on their roles.  Could not even watch it all the way through.<br /><br />The &#34;positive&#34; reviews of this movie must have been associated with the movie and/or studio.<br /><br />Wow, really, really bad.",0
Jane Russell is always good.,1
"First off I am a big fan of TWD.Fear was a tremendous disappointment. I didn't like the main charcters. The fiance goes into the without calling the police even after finding a pool of blood. Their soon escapes from the hospital and the nurse says to call the police. They still don't.  Then they go back to the church,this time with no flashlight!(wtf?). They encounter a zombie at the end and their response is so BLAND it's ridiculous! Sooo unlikely. And the staight black kid was a heroin dealer. Get real.",0
"I got exactly what I expected and left the film satisfied. Yes, this is another found film type horror flick. The entirety of the film, minus 5-10 minutes takes place in a skype video chat screen. The topic of cyber bullying is in the spotlight in society and media currently and this film puts a spotlight on it in a new way.<br /><br />The acting was above average for a film of this budget and I found myself actually scared a few times. I have been searching for a horror film that actually caused for pause when turning out the lights at night and this film came close. It won't win any awards, but I got exactly what I hoped for - A fun unique horror experience to enjoy with some friends.",1
Looks like it was filmed behind a barn by children who's grandfathers played all the rolls,0
"I really enjoyed this movie. I thought Dave Franco really made this movie. He had an awkward humor  which I truly enjoyed watching. I did not know that Vince vaungh was so tall and Dave Franco was so small! I liked the message this movie portrayed of how to never give up on your dreams keep going for what you believe In. Their also was another message on how bullying has now gone beyond school with social media's sites giving bullies the opportunity to continue their behavior after school hours.cWhich makes it hard for parents to help their child who is being bullied find a solution.  But, what Vince Vaungh told his son made perfect sense to stand out, be different. You do not want to be like everyone else. Overall I really enjoyed watching this film.",1
Kids loved it. Are starting from the beginning and rewatching the series. Quote the characters.,1
"Great movie. It's a blatant metaphor for the US/Mexican border and immigration issue, which probably accounts for it's less than amazing critic scores. This film has a heavy liberal bias, and I say that as a liberal myself. If you are strongly conservative and unable to separate your politics from your film-going experience, then this may not be your kind of film. If you could watch Avatar and still sympathize with the protagonists I think you'll be okay, but this issue strikes closer to home for some. I found the storytelling to be compelling and enjoyed the film very much.",1
"Remarkably predictable script could only have been written by an elementary school student.  Is it supposed to be a spy action romance or be a parody of one?  Either way, it fails miserably.  I felt bad for the actors and cannot imagine why someone of Zhang Ziyi's caliber (Crouching Tiger Hidden Dragon, Memoirs of a Geisha) would even be involved in this.",0
I am impressed. A man looking for redemption falls even deeper while looking for his way out. I can't wait to see how the story develops.,1
"Any Cinema with James Garner is worth watching!  This movie was a spoof of the early movie industry, with a murder mystery thrown in.  the story line was predictable and much of the acting by less well-known actors was terrible, but ... it had James Garner in it!  Bruce Willis, too, played his spoof-part with tongue-in-cheek gusto.  By the way, Tom Mix was one of the pallbearers at Wyatt Earps funeral - he was quite an admirer of Mr. Earp.  If you are a James Garner fan, as obviously I am, I think you'll enjoy this movie.  Oh ... another &#34;plus&#34; - if you are an antique car fan, the automobiles in this movie are absolutely pristine in their quality and appearance.  My goodness - I can't recall when I've see a movie with that many classic (TRULY CLASSIC) automobiles.  The movie is entertaining at the very least.",0
"I was mesmerized by the opening segment. The movie seemed a bit slow and by the 2nd Chapter, I was too invested to stop watching.  Then, the movie started coming together for me and by the end, I was captivated.  I have seen it twice now that I know what to look for and I have recommended it to my friends.",1
Great Movie with an excellent cast of stars!!,1
Beautiful classic.,1
"Five stars is not enough. Ali was the greatest both inside and outside of the ring. All Americans, and anyone anywhere that hold that freedom and human rights must be universal, should see this video. Ali was a moral giant with a stalwart internalized sense of right and wrong. He would not, and did not, bow down to a racist establishment power structure that offered odds vastly against him sustaining himself if he stood against it. He was willing to risk all of the fame and fortune that he had miraculously achieved, to suffer being barred from his profession forever if necessary, and even to go to jail. He intended to follow his spiritual/moral core beliefs no matter what. He did so and he paid dearly. He lost what many believed might have been his best 3 years in the ring when he was barred from fighting for that period of time, he had difficulty in making a living, he drew chagrin for being a black Muslim...but, when the smoke cleared he came off of the ropes victorious. This story is a salute to the human spirit of a true champion of the human race and I'm not referring to his superb boxing. His courage and dedication was an inspiration and to the benefit of<br />humanity. He was, and will remain, a true hero. Everyone should see this video. It should be mandatory in schools.",1
Just a bad movie,0
The language is horrible. I can't get into the content of the show because of the language.,0
Awesome movie but I hate it the main character,1
Good movie.,1
I needed more in this story.  Struggled to find a message,0
Outstanding comedy. Funniest dam show I have ever seen.,1
"Terrible movie, almost stopped waching within first 30 minutes.",0
It is a good depiction of Augustus' rise to power and interesting relationship he had with his daughter Julia whom later would be exiled to Pontus. There are some inaccuracies in the story and the costumes are lavish but again some minor mistakes here and there which does not detract from the movie plot or story. It is decent story of the beginning of the Roman Empire,0
"Was a big fan other Matrix, though not as much of chapters 2 and 3. Still, I was really looking forward to this movie. I think the Washowski's (sp?) put forward interesting concepts, one of the reasons I like sifi in general. But I found this a huge disappointment. This was a triumph of form over substance. It was filled with beautiful sets, CGI, exciting chases, falls,etc. Unfortunately it was mired in a trite, hackneyed plot, mediocre (at best) acting, cliche dialogue, and characters for who I could generate NO sympathy or empathy. I have to at least care whether the hero/heroine lives or dies to invest my time. This was a pretty waste of 2 hours.",0
Terrible! The two leads were bad actors and had zero chemestry...,0
Not as good as the second one as far as scare/gross factor,0
Very interesting on how the girls still do this historic art !,1
Great show.  Must watch.,1
"Loving the first movie, Divergent, I was super excited when the second one came out, Insurgent, I was super excited and read most of the second book prior to (although I didn't see it in the theater, I ran out of time) the second it came out, I RedBox'd it and after the first 30 minutes I was SOOOOO glad I had not wasted my money in the theater or bought it. The movie took out the most important parts skipping through what I thought was the whole reason behind the book which was to show how that certain faction was able to maintain its hippy type of go with the flow earthy behavior was because they were being drugged the whole time through the special tea ...... this came to light only after Tris was given the same tea and not being used to it, it had a over drugging loopy effect in her. The movie cut this whole section out and really ruined the whole movie.",0
Old,0
Interesting..,1
